{
  "meta": {
    "schema_version": "v1",
    "machine_name": "TM-LPBF-02: AconityMIDI+_OG",
    "manufacturer": "Aconity3D",
    "model": "AconityMIDI+",
    "serial_number": "500300_1",
    "file_version": "1.0",
    "export_date": "2026-06-09T19:01:02.123Z",
    "configuration_hash": "9bc38c92c582a15439fe74990c04bcf75705ca6ac499ef4332460b923400e431",
    "extra": {
      "Description": "Machine Configuration Export from Service Observations",
      "Generator": "RDT-Core Observation-Based HDF5 Config Generator"
    }
  },
  "machine": {
    "id": "fefc5037-97ab-401b-bd82-8499962d82c7",
    "machine_name": "TM-LPBF-02: AconityMIDI+_OG",
    "manufacturer": "Aconity3D",
    "model": "AconityMIDI+",
    "serial_number": "500300_1",
    "build_plate_x": 250.0,
    "build_plate_x_unit": "mm",
    "build_plate_y": 250.0,
    "build_plate_y_unit": "mm",
    "build_plate_z": 20.0,
    "build_plate_z_unit": "mm",
    "build_plate_radius": 125.0,
    "build_plate_radius_unit": "mm",
    "gas_flow_direction": "Y+",
    "recoat_direction": "X+",
    "recoater_blade_type": null
  },
  "optical_trains": [
    {
      "train_id": "Optical_Train_01",
      "id": null,
      "beam_profile_type": null,
      "beam_waist_definition": "knife-edge",
      "beam_waist_major": 66.72965,
      "beam_waist_major_unit": "μm",
      "beam_waist_minor": 68.12519999999999,
      "beam_waist_minor_unit": "μm",
      "beam_waist_offset_z": 0.4570686666666666,
      "beam_waist_offset_z_unit": "mm",
      "build_plane_offset_major": 0.216544,
      "build_plane_offset_major_unit": "mm",
      "build_plane_offset_minor": 0.6975933333333333,
      "build_plane_offset_minor_unit": "mm",
      "collimator_focal_length": 120.0,
      "collimator_focal_length_unit": "mm",
      "m2_major": 1.042816666666667,
      "m2_minor": 1.08339,
      "major_axis_angle": 0.0,
      "major_axis_angle_unit": "degrees",
      "rayleigh_length_major": 3.13428,
      "rayleigh_length_major_unit": "mm",
      "rayleigh_length_minor": 3.144416666666666,
      "rayleigh_length_minor_unit": "mm",
      "scanner_number": null,
      "thermal_lensing_passed": false,
      "thermal_lensing_focal_plane_shift": 1.178387083333333,
      "thermal_lensing_focal_plane_shift_unit": "mm",
      "thermal_lensing_threshold": 0.7848370833333334,
      "thermal_lensing_threshold_unit": "mm",
      "scanner": {
        "manufacturer": "Aconity3D",
        "model": "AconityScan",
        "serial_number": "01522024181",
        "working_distance": 670.0,
        "working_distance_unit": "mm",
        "scan_field_x": 600.0,
        "scan_field_x_unit": "mm",
        "scan_field_y": 600.0,
        "scan_field_y_unit": "mm",
        "scan_field_z": 76.5,
        "scan_field_z_unit": "mm",
        "scan_head_offset_x": -87.5,
        "scan_head_offset_x_unit": "mm",
        "scan_head_offset_y": 23.5,
        "scan_head_offset_y_unit": "mm",
        "scan_head_offset_z": -1.0,
        "scan_head_offset_z_unit": "mm",
        "scan_head_rotation": 0.0,
        "scan_head_rotation_unit": "degrees",
        "axis_configuration": "3D",
        "x_axis": {
          "actual_bit_resolution": 20,
          "actual_bit_resolution_unit": "bits",
          "commanded_bit_resolution": 20,
          "commanded_bit_resolution_unit": "bits",
          "control_type": null,
          "range_of_motion": null,
          "range_of_motion_unit": "mm",
          "smoothing_kernel": "GAUSSIAN",
          "smoothing_parameters": 60.0,
          "tuning_parameters": null,
          "tuning_type": null
        },
        "y_axis": {
          "actual_bit_resolution": 20,
          "actual_bit_resolution_unit": "bits",
          "commanded_bit_resolution": 20,
          "commanded_bit_resolution_unit": "bits",
          "control_type": null,
          "range_of_motion": null,
          "range_of_motion_unit": "mm",
          "smoothing_kernel": "GAUSSIAN",
          "smoothing_parameters": 60.0,
          "tuning_parameters": null,
          "tuning_type": null
        },
        "z_axis": {
          "actual_bit_resolution": 20,
          "actual_bit_resolution_unit": "bits",
          "commanded_bit_resolution": 20,
          "commanded_bit_resolution_unit": "bits",
          "control_type": null,
          "range_of_motion": null,
          "range_of_motion_unit": "mm",
          "smoothing_kernel": "GAUSSIAN",
          "smoothing_parameters": 60.0,
          "tuning_parameters": null,
          "tuning_type": null
        },
        "focus": null
      },
      "light_source": {
        "manufacturer": "nLIGHT",
        "model": "NL-FLS-R11-1.00-1070-230",
        "serial_number": "31070",
        "wavelength": 1070.0,
        "wavelength_unit": "nm",
        "power_max_nominal": 1000.0,
        "power_max_nominal_unit": "W",
        "power_max_actual": 1033.0,
        "power_max_actual_unit": "W",
        "power_min_actual": 101.7,
        "power_min_actual_unit": "W",
        "power_min_nominal": null,
        "power_min_nominal_unit": "W",
        "power_bit_resolution": null,
        "power_bit_resolution_unit": "bits",
        "power_characterization": {
          "algorithm_type": "LINEAR",
          "algorithm_equation": "W = a*V + b",
          "input_type": null,
          "units_derived_quantity": null,
          "derivation_equation_constants": [],
          "characterization_points": [
            {
              "input_value": 1.0,
              "output_value": 102.56666666666666
            },
            {
              "input_value": 3.0,
              "output_value": 305.5333333333333
            },
            {
              "input_value": 6.0,
              "output_value": 617.9
            },
            {
              "input_value": 9.0,
              "output_value": 929.9333333333334
            },
            {
              "input_value": 10.0,
              "output_value": 1028.0
            }
          ]
        }
      },
      "collimator": {
        "manufacturer": "IPG",
        "model": "D50_F120_WC",
        "serial_number": "CO3271210",
        "focal_length": 120.0,
        "focal_length_unit": "mm"
      },
      "scanner_card": {
        "manufacturer": "Raylase",
        "model": "SP-ICE-3",
        "serial_number": "SP314244",
        "communication_protocol": "SL2-100",
        "sample_period": 10.0,
        "sample_period_unit": "μs"
      },
      "scan_field_correction_file": {
        "document_name": "Story6.17.3.1_Laser_1_VMM.fc3",
        "document_id": "c1e808bc-75a3-4998-b009-72f37068b1e4",
        "file_size": 1138799,
        "valid_as_of_date": "2026-06-09T19:01:01.474Z",
        "document_created_at": "2026-02-25T17:24:35.972Z",
        "document_type": "Scan Field Correction File",
        "original_uri": "/app/files/Machines/scan-field-corrections/file-1772040275921-177148350.fc3"
      }
    },
    {
      "train_id": "Optical_Train_02",
      "id": null,
      "beam_profile_type": null,
      "beam_waist_definition": "knife-edge",
      "beam_waist_major": 68.13666666666667,
      "beam_waist_major_unit": "μm",
      "beam_waist_minor": 68.15921666666667,
      "beam_waist_minor_unit": "μm",
      "beam_waist_offset_z": 0.5590780000000001,
      "beam_waist_offset_z_unit": "mm",
      "build_plane_offset_major": -0.3946656666666666,
      "build_plane_offset_major_unit": "mm",
      "build_plane_offset_minor": 1.512821666666667,
      "build_plane_offset_minor_unit": "mm",
      "collimator_focal_length": 120.0,
      "collimator_focal_length_unit": "mm",
      "m2_major": 1.045366666666667,
      "m2_minor": 1.069846666666667,
      "major_axis_angle": 0.0,
      "major_axis_angle_unit": "degrees",
      "rayleigh_length_major": 3.259905,
      "rayleigh_length_major_unit": "mm",
      "rayleigh_length_minor": 3.187398333333333,
      "rayleigh_length_minor_unit": "mm",
      "scanner_number": null,
      "thermal_lensing_passed": true,
      "thermal_lensing_focal_plane_shift": 0.1906766666666668,
      "thermal_lensing_focal_plane_shift_unit": "mm",
      "thermal_lensing_threshold": 0.8059129166666665,
      "thermal_lensing_threshold_unit": "mm",
      "scanner": {
        "manufacturer": "Aconity3D",
        "model": "AconityScan",
        "serial_number": "01512024201",
        "working_distance": 670.0,
        "working_distance_unit": "mm",
        "scan_field_x": 600.0,
        "scan_field_x_unit": "mm",
        "scan_field_y": 600.0,
        "scan_field_y_unit": "mm",
        "scan_field_z": 76.5,
        "scan_field_z_unit": "mm",
        "scan_head_offset_x": 86.074,
        "scan_head_offset_x_unit": "mm",
        "scan_head_offset_y": -21.695,
        "scan_head_offset_y_unit": "mm",
        "scan_head_offset_z": -1.0,
        "scan_head_offset_z_unit": "mm",
        "scan_head_rotation": 180.0,
        "scan_head_rotation_unit": "degrees",
        "axis_configuration": "3D",
        "x_axis": {
          "actual_bit_resolution": 20,
          "actual_bit_resolution_unit": "bits",
          "commanded_bit_resolution": 20,
          "commanded_bit_resolution_unit": "bits",
          "control_type": null,
          "range_of_motion": null,
          "range_of_motion_unit": "mm",
          "smoothing_kernel": null,
          "smoothing_parameters": null,
          "tuning_parameters": null,
          "tuning_type": null
        },
        "y_axis": {
          "actual_bit_resolution": 20,
          "actual_bit_resolution_unit": "bits",
          "commanded_bit_resolution": 20,
          "commanded_bit_resolution_unit": "bits",
          "control_type": null,
          "range_of_motion": null,
          "range_of_motion_unit": "mm",
          "smoothing_kernel": null,
          "smoothing_parameters": null,
          "tuning_parameters": null,
          "tuning_type": null
        },
        "z_axis": {
          "actual_bit_resolution": 20,
          "actual_bit_resolution_unit": "bits",
          "commanded_bit_resolution": 20,